{
  "catalog_schema_version": "1.0.0",
  "api_version": "v1",
  "base_path": "/api/v1",
  "status": "P6-WP3 API CONTRACT APPROVED FOLLOWING INDEPENDENT REVIEW — REMOTE CI + MERGE PENDING",
  "authority_note": "Machine-readable source for P6-WP4 OpenAPI. Not OpenAPI, not an implementation, not runtime authority. API-001 is the normative human-readable contract. Hand edits must pass the JSON Schema, validate_api_contract.py (including negative mutations), the CI self-test and the canonical gate.",
  "human_contract": "docs/06-contracts/API-001-api-resource-protocol-contract.md",
  "persistence_contract": "contracts/postgresql/schema-v1.json",
  "tenancy": {
    "asm_002_status": "UNCONFIRMED_PROVISIONAL",
    "tenant_fields_permitted": false,
    "note": "Single provisional deployment scope; no tenant field anywhere. Re-review required before implementation if multi-tenancy is confirmed."
  },
  "conventions": {
    "identifiers": "opaque UUIDv4 (canonical lowercase text); knowledge identifiers (rule_id, content_digest) are governed and separate",
    "timestamps": "RFC 3339 UTC; server-authoritative",
    "json_content_type": "application/json",
    "idempotency_header": "Idempotency-Key",
    "concurrency": "ETag + If-Match (strong, opaque)",
    "correlation_header": "X-Request-Id (server-generated)",
    "pagination": "opaque cursor; limit bounded by implementation configuration (NOT YET SPECIFIED)"
  },
  "roles": [
    "USER",
    "ANALYST",
    "KNOWLEDGE_EDITOR",
    "KNOWLEDGE_APPROVER",
    "ADMINISTRATOR"
  ],
  "error_codes": [
    {
      "code": "INVALID_REQUEST",
      "http_status": 400,
      "retryability": "RETRY_WITH_CHANGES",
      "meaning": "Malformed body, unknown/forbidden field, enum/length/format violation, declared/actual length mismatch."
    },
    {
      "code": "UNAUTHENTICATED",
      "http_status": 401,
      "retryability": "RETRY_WITH_CHANGES",
      "meaning": "Missing/invalid/expired credential."
    },
    {
      "code": "FORBIDDEN",
      "http_status": 403,
      "retryability": "NOT_RETRYABLE",
      "meaning": "Caller can see the resource but lacks the role or permission for this operation."
    },
    {
      "code": "NOT_FOUND",
      "http_status": 404,
      "retryability": "NOT_RETRYABLE",
      "meaning": "Resource does not exist OR caller has no access to its case scope (existence masked)."
    },
    {
      "code": "CONFLICT",
      "http_status": 409,
      "retryability": "NOT_RETRYABLE",
      "meaning": "Uniqueness or relationship conflict."
    },
    {
      "code": "IDEMPOTENCY_KEY_REUSED",
      "http_status": 409,
      "retryability": "RETRY_WITH_CHANGES",
      "meaning": "Same Idempotency-Key reused with a different request."
    },
    {
      "code": "IDEMPOTENCY_IN_PROGRESS",
      "http_status": 409,
      "retryability": "RETRYABLE",
      "meaning": "Original request with this key is still executing."
    },
    {
      "code": "STATE_CONFLICT",
      "http_status": 409,
      "retryability": "NOT_RETRYABLE",
      "meaning": "Command not allowed in the resource's current state."
    },
    {
      "code": "EVALUATION_NOT_COMPLETED",
      "http_status": 409,
      "retryability": "RETRYABLE",
      "meaning": "Result/replay requested for an evaluation that is not COMPLETED (queued/running) or failed."
    },
    {
      "code": "PRECONDITION_FAILED",
      "http_status": 412,
      "retryability": "RETRY_WITH_CHANGES",
      "meaning": "If-Match / expected-state guard did not match."
    },
    {
      "code": "PRECONDITION_REQUIRED",
      "http_status": 428,
      "retryability": "RETRY_WITH_CHANGES",
      "meaning": "If-Match required but absent."
    },
    {
      "code": "REMOVED_UNDER_GOVERNANCE",
      "http_status": 410,
      "retryability": "NOT_RETRYABLE",
      "meaning": "Content or result was deleted under governed retention/deletion; historical record only."
    },
    {
      "code": "PAYLOAD_TOO_LARGE",
      "http_status": 413,
      "retryability": "RETRY_WITH_CHANGES",
      "meaning": "Exceeds the configured size bound (value NOT YET SPECIFIED)."
    },
    {
      "code": "UNSUPPORTED_MEDIA_TYPE",
      "http_status": 415,
      "retryability": "RETRY_WITH_CHANGES",
      "meaning": "Media type not accepted or content fails media validation beyond extension."
    },
    {
      "code": "RATE_LIMITED",
      "http_status": 429,
      "retryability": "RETRYABLE",
      "meaning": "Admission control; Retry-After may be returned (thresholds NOT YET SPECIFIED)."
    },
    {
      "code": "DEPENDENCY_UNAVAILABLE",
      "http_status": 503,
      "retryability": "RETRYABLE",
      "meaning": "Required dependency (operational store, evidence store, key operation, identity validation) unavailable; nothing claimed complete."
    },
    {
      "code": "INTEGRITY_FAILURE",
      "http_status": 500,
      "retryability": "NOT_RETRYABLE",
      "meaning": "Stored material failed integrity verification; content withheld; investigated."
    },
    {
      "code": "REPLAY_UNAVAILABLE",
      "http_status": 409,
      "retryability": "NOT_RETRYABLE",
      "meaning": "Replay cannot be accepted because required pinned material is already known to be removed."
    },
    {
      "code": "REPORT_REGENERATION_UNAVAILABLE",
      "http_status": 409,
      "retryability": "NOT_RETRYABLE",
      "meaning": "Report content cannot be produced because required pinned sources were removed under governance."
    },
    {
      "code": "KNOWLEDGE_NOT_ELIGIBLE",
      "http_status": 409,
      "retryability": "NOT_RETRYABLE",
      "meaning": "Exact bundle not published/validated or withdrawn; activation refused."
    },
    {
      "code": "INTERNAL_ERROR",
      "http_status": 500,
      "retryability": "RETRYABLE",
      "meaning": "Unexpected failure; safe message only."
    }
  ],
  "vocabularies": {
    "principal_kind": {
      "source": "PERSISTENCE",
      "persistence_vocabulary": "principal_kind"
    },
    "trustlens_role": {
      "source": "PERSISTENCE",
      "persistence_vocabulary": "trustlens_role"
    },
    "relationship_to_content": {
      "source": "PERSISTENCE",
      "persistence_vocabulary": "relationship_to_content"
    },
    "input_type": {
      "source": "PERSISTENCE",
      "persistence_vocabulary": "input_type"
    },
    "artifact_kind": {
      "source": "PERSISTENCE",
      "persistence_vocabulary": "artifact_kind"
    },
    "evaluation_origin": {
      "source": "PERSISTENCE",
      "persistence_vocabulary": "evaluation_origin"
    },
    "ai_fallback_reason": {
      "source": "PERSISTENCE",
      "persistence_vocabulary": "ai_fallback_reason"
    },
    "input_support_status": {
      "source": "PERSISTENCE",
      "persistence_vocabulary": "input_support_status"
    },
    "classification": {
      "source": "PERSISTENCE",
      "persistence_vocabulary": "classification"
    },
    "decision_severity": {
      "source": "PERSISTENCE",
      "persistence_vocabulary": "decision_severity"
    },
    "matched_evidence_strength": {
      "source": "PERSISTENCE",
      "persistence_vocabulary": "matched_evidence_strength"
    },
    "risk_level": {
      "source": "PERSISTENCE",
      "persistence_vocabulary": "risk_level"
    },
    "detection_confidence": {
      "source": "PERSISTENCE",
      "persistence_vocabulary": "detection_confidence"
    },
    "rule_kind": {
      "source": "PERSISTENCE",
      "persistence_vocabulary": "rule_kind"
    },
    "rule_evaluation_state": {
      "source": "PERSISTENCE",
      "persistence_vocabulary": "rule_evaluation_state"
    },
    "rule_effective_severity": {
      "source": "PERSISTENCE",
      "persistence_vocabulary": "rule_effective_severity"
    },
    "rule_evidence_strength": {
      "source": "PERSISTENCE",
      "persistence_vocabulary": "rule_evidence_strength"
    },
    "rule_detection_confidence": {
      "source": "PERSISTENCE",
      "persistence_vocabulary": "rule_detection_confidence"
    },
    "enrichment_status": {
      "source": "PERSISTENCE",
      "persistence_vocabulary": "enrichment_status"
    },
    "reputation_result": {
      "source": "PERSISTENCE",
      "persistence_vocabulary": "reputation_result"
    },
    "adjudication_outcome": {
      "source": "PERSISTENCE",
      "persistence_vocabulary": "adjudication_outcome"
    },
    "review_routing_basis": {
      "source": "PERSISTENCE",
      "persistence_vocabulary": "review_routing_basis"
    },
    "case_grant_kind": {
      "source": "PERSISTENCE",
      "persistence_vocabulary": "case_grant_kind"
    },
    "replay_capability_state": {
      "source": "PERSISTENCE",
      "persistence_vocabulary": "replay_capability_state"
    },
    "replay_outcome": {
      "source": "PERSISTENCE",
      "persistence_vocabulary": "replay_outcome"
    },
    "replay_material_kind": {
      "source": "PERSISTENCE",
      "persistence_vocabulary": "replay_material_kind"
    },
    "knowledge_governance_eligibility": {
      "source": "PERSISTENCE",
      "persistence_vocabulary": "knowledge_governance_eligibility"
    },
    "activation_action_kind": {
      "source": "PERSISTENCE",
      "persistence_vocabulary": "activation_action_kind"
    },
    "activation_lifecycle_state": {
      "source": "PERSISTENCE",
      "persistence_vocabulary": "activation_lifecycle_state"
    },
    "operation_outcome": {
      "source": "PERSISTENCE",
      "persistence_vocabulary": "operation_outcome"
    },
    "deletion_scope_kind": {
      "source": "PERSISTENCE",
      "persistence_vocabulary": "deletion_scope_kind"
    },
    "break_glass_scope": {
      "source": "PERSISTENCE",
      "persistence_vocabulary": "break_glass_scope"
    },
    "break_glass_review_state": {
      "source": "PERSISTENCE",
      "persistence_vocabulary": "break_glass_review_state"
    },
    "audit_event_type": {
      "source": "PERSISTENCE",
      "persistence_vocabulary": "audit_event_type"
    },
    "actor_kind": {